{
  "jmdn_version": "1.0",
  "status": "FISCAL_CLEARED",
  "message_id": "MSG-20260309-001234",
  "document_ref": "FAC-2026-000123",
  "cleared_at": "2026-03-09T15:00:03Z",
  "payload_hash_sha256": "a3f1b9c8d2e4f6a7b8c9d0e1f2a3b4c5d6e7f8a9b0c1d2e3f4a5b6c7d8e9f0a1",
  "merkle_proof": {
    "leaf_hash": "a3f1b9c8d2e4f6a7b8c9d0e1f2a3b4c5d6e7f8a9b0c1d2e3f4a5b6c7d8e9f0a1",
    "tree_root": "m5n6o7p8q9r0s1t2u3v4w5x6y7z8a9b0c1d2e3f4a5b6c7d8e9f0a1b2c3d4e5f6",
    "proof_path": [
      {
        "position": "right",
        "hash": "c1d2e3f4a5b6c7d8e9f0a1b2c3d4e5f6a7b8c9d0e1f2a3b4c5d6e7f8a9b0c1d2"
      },
      {
        "position": "left",
        "hash": "e5f6a7b8c9d0e1f2a3b4c5d6e7f8a9b0c1d2e3f4a5b6c7d8e9f0a1b2c3d4e5f6"
      }
    ],
    "anchored_at_block": 9871234,
    "anchor_tx_hash": "0xabc123def456789abcdef0123456789abcdef0123456789abcdef0123456789ab",
    "anchor_timestamp": "2026-03-09T15:00:01Z"
  },
  "observer_registration_id": "SENIAT-2026-789456",
  "receiver_gln": "7599876500001",
  "jws_signature": "eyJhbGciOiJFUzI1NiIsImtpZCI6ImZpZGV4LWh1Yi0yMDI2MDEifQ.eyJqbWRuX3ZlcnNpb24iOiIxLjAiLCJzdGF0dXMiOiJGSVNDQUxfQ0xFQVJFRCIsIm1lc3NhZ2VfaWQiOiJNU0ctMjAyNjAzMDktMDAxMjM0In0.SflKxwRJSMeKKF2QT4fwpMeJf36POk6yJV_adQssw5d"
}
