{
  "jmdn_version": "1.0",
  "status": "NETWORK_DELIVERED",
  "message_id": "MSG-20260309-001234",
  "document_ref": "FAC-2026-000123",
  "received_at": "2026-03-09T14:30:00.847Z",
  "payload_hash_sha256": "a3f1b9c8d2e4f6a7b8c9d0e1f2a3b4c5d6e7f8a9b0c1d2e3f4a5b6c7d8e9f0a1",
  "receiver_gln": "7599876500001",
  "jws_signature": "eyJhbGciOiJFUzI1NiIsImtpZCI6ImZpZGV4LWh1Yi0yMDI2MDEifQ.eyJqbWRuX3ZlcnNpb24iOiIxLjAiLCJzdGF0dXMiOiJORVRXT1JLX0RFTElWRVJFRCIsIm1lc3NhZ2VfaWQiOiJNU0ctMjAyNjAzMDktMDAxMjM0In0.SflKxwRJSMeKKF2QT4fwpMeJf36POk6yJV_adQssw5c"
}
